{
  "people":[
    {
      "id":1,
      "name":"Kenneth James",
      "email":"raterequests@alllogistics.com",
      "tickets":132
    },
    {
      "id":2,
      "name":"Richard Blaine",
      "email":"hello@email.co.uk",
      "tickets":76
    }
  ],
  "tickets":[
    {
      "id":83995,
      "subject":"Pricing and Purchasing Questions",
      "agent":1,
      "messages":[
        {
          "id":123,
          "text":"Many software vendors have government rate pricing that differs from the"
        }
      ]
    },
    {
      "id":74562,
      "subject":"'Pricing and translations",
      "agent":2,
      "messages":[
        {
          "id":123,
          "text":"...discount policy. The On-Premise pricing is very competitive so it's ..."
        }
      ]
    },
    {
      "id":63331,
      "subject":"ASP Licensing",
      "agent":2,
      "messages":[
        {
          "id":123,
          "text":"if I could make the pricing attractive enough. Several of them are small, and don't ha..."
        }
      ]
    }
  ],
  "community":[
    {
      "id":83995,
      "title":"Community result"
    }
  ],
  "news":[
    {
      "id":83995,
      "title":"News result"
    },
    {
      "id":83996,
      "title":"News result"
    },
    {
      "id":83997,
      "title":"News result"
    }
  ],
  "downloads":[
    {
      "id":83995,
      "title":"Download result"
    }
  ]
}