{
  "organizations":[
    {
      "id":1,
      "name":"Deskpro",
      "members":123,
      "img": "http://localhost/file.php/avatar/25/default.jpg?size-fit=1"
    },
    {
      "id":2,
      "name":"Deskpro",
      "members":123,
      "img": "http://localhost/file.php/avatar/25/default.jpg?size-fit=1"
    }
  ],
  "people":[
    {
      "id":1,
      "name":"Kenneth James",
      "email":"raterequests@alllogistics.com",
      "tickets":132,
      "img": "http://localhost/file.php/avatar/25/default.jpg?size-fit=1"
    },
    {
      "id":2,
      "name":"Richard Blaine",
      "email":"hello@email.co.uk",
      "tickets":76,
      "img": "http://localhost/file.php/avatar/25/default.jpg?size-fit=1"
    }
  ],
  "tickets":[
    {
      "id":83995,
      "subject":"Pricing and Purchasing Questions",
      "person_name": "Kenneth James",
      "person_email": "kenneth@windfarm.co.uk",
      "agent":1,
      "urgency": 11,
      "messages":[
        {
          "id":123,
          "text":"Many software vendors have government rate pricing that differs from the"
        },
        {
          "id":124,
          "text":"..discount policy. The On-Premise pricing is very competitive so it's ..."
        }
      ]
    },
    {
      "id":74562,
      "subject":"'Pricing and translations",
      "person_name": "Toby Falkirk",
      "person_email": "t.falkirk@rambling.com",
      "agent":2,
      "urgency": 4,
      "messages":[
        {
          "id":123,
          "text":"...discount policy. The On-Premise pricing is very competitive so it's ..."
        }
      ]
    },
    {
      "id":63331,
      "subject":"ASP Licensing",
      "person_name": "Mary Jarvis",
      "person_email": "mjarvis@econorob.nl",
      "agent":3,
      "messages":[
        {
          "id":123,
          "text":"if I could make the pricing attractive enough. Several of them are small, and don't ha..."
        }
      ]
    }
  ],
  "community":[
    {
      "id":83995,
      "title":"Community result"
    }
  ],
  "articles":[
    {
      "id":83995,
      "title":"Article result",
      "status":"Published",
      "content":"Duis aute irure dolor in reprehenderit in voluptate velit esse cillum dolore eu fugiat nulla pariatur."
    },
    {
      "id":83996,
      "title":"Article result",
      "status":"Published",
      "content":"Duis aute irure dolor in reprehenderit in voluptate velit esse cillum dolore eu fugiat nulla pariatur."
    },
    {
      "id":83997,
      "title":"Article result",
      "status":"Published",
      "content":"Duis aute irure dolor in reprehenderit in voluptate velit esse cillum dolore eu fugiat nulla pariatur."
    }
  ],
  "news":[
    {
      "id":83995,
      "title":"News result"
    },
    {
      "id":83996,
      "title":"News result"
    },
    {
      "id":83997,
      "title":"News result"
    }
  ],
  "downloads":[
    {
      "id":83995,
      "title":"Download result"
    }
  ],
  "admin":[
    {
      "title":"Admin result"
    },
    {
      "title":"Admin result"
    }
  ]
}
